{
  "schema": 1,
  "service": "nddev-device-sync-cache",
  "access": {
    "transport": "estate-admitted forwards",
    "base": "http://127.0.0.1:{port}",
    "admission": "A device or private runner reaches the same central cache listener through an estate-admitted remote-access forward, such as restricted SSH or rds forward. Redundant routes share that central store; no route falls back to a public source. Host, ticket, port and admitted identities live in the private estate."
  },
  "integrity": "The cache commits an object only after a complete download; OCI digest paths and checksum-pinned GitHub assets additionally require the named SHA-256. It generates crates.io index config.json and rewrites download links in PyPI and pub documents to the client's loopback base. npm links stay public, except that Bun gets the public registry's tarball links empty and builds them from its configured registry; artifact bytes stay unchanged. Clients keep their own digest and signature checks.",
  "routes": [
    {
      "id": "rustup",
      "prefix": "/rustup",
      "upstream": "https://static.rust-lang.org",
      "objects": "Distribution components and rustup releases; channel manifests are revalidated.",
      "clients": [
        {"tool": "rustup toolchains", "setting": {"RUSTUP_DIST_SERVER": "{base}/rustup"}, "acceptance": "real client"},
        {"tool": "rustup self-update and rustup-init", "setting": {"RUSTUP_UPDATE_ROOT": "{base}/rustup/rustup"}, "acceptance": "route only"}
      ]
    },
    {
      "id": "flutter",
      "prefix": "/flutter",
      "upstream": "https://storage.googleapis.com",
      "objects": "Flutter SDK, engine and Dart SDK archives and the Flutter Maven repository; release indexes and Maven metadata are revalidated.",
      "clients": [
        {
          "tool": "flutter",
          "setting": {"FLUTTER_STORAGE_BASE_URL": "{base}/flutter"},
          "acceptance": "route only",
          "limits": "Gradle refuses plain-HTTP Maven repositories without an explicit opt-in, so Android engine artifacts need TLS in front of the forwarded port. Pub packages are a later increment."
        }
      ]
    },
    {
      "id": "python-build-standalone",
      "prefix": "/python-build-standalone",
      "upstream": "https://github.com/astral-sh/python-build-standalone/releases/download",
      "objects": "CPython release archives of dated release tags.",
      "clients": [
        {"tool": "uv python install", "setting": {"UV_PYTHON_INSTALL_MIRROR": "{base}/python-build-standalone"}, "acceptance": "real client"}
      ]
    },
    {
      "id": "github-releases",
      "prefix": "/github-releases",
      "upstream": "https://github.com",
      "objects": "Public uploaded release assets under exact owner/repository/releases/download/tag/asset paths, with a caller-pinned SHA-256 in the cache URL. Only bytes matching that digest are committed. An escaped slash is allowed only within the release tag.",
      "clients": [
        {"tool": "curl with pinned digest verification and native archive consumption", "setting": {"download_url": "{base}/github-releases/sha256/{sha256}/{owner}/{repository}/releases/download/{tag}/{asset}"}, "acceptance": "real client", "limits": "Qualified on Linux x86_64 with native curl, an independent size/SHA-256 pin, verified archive extraction and execution of the downloaded tool. A fresh local installation from the retained verified archive succeeds with central unavailable; a cold curl download refuses without public fallback. This does not give curl an offline package cache or qualify another platform, installer, project binding or tool selection. Public uploaded assets only; no API, latest-release resolution, caller authentication, source archives or automatic URL rewriting. The consumer keeps its own size, digest and signature checks and must not retry a public URL after a cache failure."}
      ]
    },
    {
      "id": "playwright",
      "prefix": "/playwright",
      "upstream": "https://cdn.playwright.dev",
      "objects": "Playwright browser and tool builds.",
      "clients": [
        {"tool": "playwright install", "setting": {"PLAYWRIGHT_DOWNLOAD_HOST": "{base}/playwright"}, "acceptance": "route only"}
      ]
    },
    {
      "id": "gradle",
      "prefix": "/gradle",
      "upstream": "https://services.gradle.org",
      "objects": "Gradle distributions and their checksum files.",
      "clients": [
        {
          "tool": "gradle wrapper",
          "setting": {"distributionUrl": "{base}/gradle/distributions/gradle-{version}-bin.zip"},
          "acceptance": "route only",
          "limits": "Keep distributionSha256Sum. Whether the wrapper accepts a plain-HTTP distributionUrl is not verified."
        }
      ]
    },
    {
      "id": "go",
      "prefix": "/go",
      "upstream": "https://dl.google.com/go",
      "objects": "Go release archives and their checksum files.",
      "clients": [
        {
          "tool": "go release archives",
          "setting": {"download_url": "{base}/go/{file}"},
          "acceptance": "route only",
          "limits": "GOTOOLCHAIN downloads go through the goproxy route instead."
        }
      ]
    },
    {
      "id": "chrome-for-testing",
      "prefix": "/chrome-for-testing",
      "upstream": "https://storage.googleapis.com/chrome-for-testing-public",
      "objects": "Chrome, ChromeDriver and headless shell archives of exact Chrome for Testing versions.",
      "clients": [
        {
          "tool": "chrome for testing archives",
          "setting": {"download_url": "{base}/chrome-for-testing/{version}/{platform}/{product}-{platform}.zip"},
          "acceptance": "route only",
          "limits": "Version indexes on googlechromelabs.github.io are not proxied; resolve the version upstream or from a pinned lock."
        }
      ]
    },
    {
      "id": "crates-index",
      "prefix": "/crates-index",
      "upstream": "https://index.crates.io",
      "objects": "Sparse index files of crates.io; they are revalidated. The cache answers config.json itself and points crate downloads at the crates route of the base address the client used.",
      "clients": [
        {
          "tool": "cargo, replacing the crates-io source",
          "setting": {"source.crates-io.replace-with": "nds-cache", "source.nds-cache.registry": "sparse+{base}/crates-index/"},
          "acceptance": "real client",
          "limits": "Set through cargo --config or a Cargo configuration file: Cargo reads source replacement from no environment variable. Index changes reach clients after the revalidation age. Cargo names its local registry cache by the URL, port included, so a client keeps one forwarded port to reuse it."
        }
      ]
    },
    {
      "id": "crates",
      "prefix": "/crates",
      "upstream": "https://static.crates.io/crates",
      "objects": "Crate archives of exact published versions; Cargo checks each one against the checksum in its index entry.",
      "clients": [
        {
          "tool": "cargo, through the index configuration the cache generates",
          "setting": {"dl": "{base}/crates/{crate}/{crate}-{version}.crate"},
          "acceptance": "real client",
          "limits": "No client setting: the config.json of the crates-index route carries this download template."
        }
      ]
    },
    {
      "id": "npm",
      "prefix": "/npm",
      "upstream": "https://registry.npmjs.org",
      "objects": "Package documents in the representation the client accepts, the install document or the full document, revalidated and served with the public tarball links upstream sent, or to Bun as the install document with the public registry's tarball links empty; tarballs of exact published versions, which clients check against the integrity in the document.",
      "clients": [
        {
          "tool": "npm install and npm ci",
          "setting": {"registry": "{base}/npm/"},
          "acceptance": "real client",
          "limits": "nds-cache bind writes the registry into a global configuration file of its own, which npm_config_globalconfig in the environment file names, because Bun reads npm's user file and variables but not that file; npm is bound where the environment file applies. The user's and the project's .npmrc rank above it, and while bound npm reads it in place of its default global file. npm's default replace-registry-host fetches the public tarball links of a package document through the cache, so package-lock.json keeps registry.npmjs.org; a project that sets replace-registry-host to never downloads tarballs directly. Audit, search, login and publish endpoints are not proxied; run npm without audit."
        },
        {
          "tool": "bun install and bun install --frozen-lockfile",
          "setting": {"registry": "{base}/npm/"},
          "acceptance": "real client",
          "limits": "A project or job selects the route with --registry or a default registry in its own .npmrc; the device client leaves Bun unbound, because Bun does not read the npm global configuration file. A User-Agent that opens with Bun/ gets the install document with the tarball links under https://registry.npmjs.org/ empty, which Bun builds from its configured registry, so online and frozen installs download through the cache, and a bun.lock that Bun creates or installs from unchanged records those packages with an empty registry, as a public install does. Bun loads an empty registry as its configured one, so bun add, bun update or an edited package.json through the route write the cache address into the entries the lockfile already held; author those changes against the canonical registry. Scoped registries and their credentials in the project's or job's .npmrc keep precedence and do not pass through the cache. A tarball link to another host stays as upstream sent it."
        }
      ]
    },
    {
      "id": "pypi",
      "prefix": "/pypi",
      "upstream": "https://pypi.org",